{"$id":"owner-capacity-feasible-world-template-v0.5.schema.json","$schema":"https://json-schema.org/draft/2020-12/schema","additionalProperties":false,"properties":{"ambiguous_overrides":{"items":{"additionalProperties":false,"properties":{"owner_option_id":{"minimum":0,"type":"integer"},"variable_id":{"minimum":0,"type":"integer"}},"required":["owner_option_id","variable_id"],"type":"object"},"type":"array"},"artifact_binding":{"additionalProperties":false,"properties":{"digest_domain":{"const":"canonical_candidate_artifact_bytes"},"kind":{"const":"deferred_exact_sha256"},"placeholder":{"const":"${ARTIFACT_SHA256}"},"replacement_count":{"const":1},"required_format":{"const":"lowercase_hex_64"}},"required":["digest_domain","kind","placeholder","replacement_count","required_format"],"type":"object"},"assignment_mode":{"const":"singleton_plus_overrides"},"axis":{"enum":["max_carriers","max_pixel_variables","max_total_rle_runs"]},"observation_sha256":{"pattern":"^[0-9a-f]{64}$","type":"string"},"schema_version":{"const":"owner-capacity-feasible-world-template-v0.5"},"side":{"const":"L"},"source_sha256":{"pattern":"^[0-9a-f]{64}$","type":"string"},"training_authorized":{"const":false}},"required":["ambiguous_overrides","artifact_binding","assignment_mode","axis","observation_sha256","schema_version","side","source_sha256","training_authorized"],"title":"Deferred feasible-world witness template","type":"object"}
