{"ambiguous_overrides":[{"owner_option_id":0,"variable_id":5},{"owner_option_id":0,"variable_id":13},{"owner_option_id":0,"variable_id":14},{"owner_option_id":0,"variable_id":23},{"owner_option_id":0,"variable_id":24},{"owner_option_id":0,"variable_id":33},{"owner_option_id":0,"variable_id":34},{"owner_option_id":0,"variable_id":43},{"owner_option_id":0,"variable_id":44},{"owner_option_id":0,"variable_id":52}],"artifact_binding":{"digest_domain":"canonical_candidate_artifact_bytes","kind":"deferred_exact_sha256","placeholder":"${ARTIFACT_SHA256}","replacement_count":1,"required_format":"lowercase_hex_64"},"assignment_mode":"singleton_plus_overrides","axis":"max_carriers","observation_sha256":"79cedc830035f27e12639398259cd0a414199f52d5fcbf151c771617bbb9d776","schema_version":"owner-capacity-feasible-world-template-v0.5","side":"L","source_sha256":"79cedc830035f27e12639398259cd0a414199f52d5fcbf151c771617bbb9d776","training_authorized":false}
