{"ambiguous_overrides":[],"artifact_binding":{"digest_domain":"canonical_candidate_artifact_bytes","kind":"deferred_exact_sha256","placeholder":"${ARTIFACT_SHA256}","replacement_count":1,"required_format":"lowercase_hex_64"},"assignment_mode":"singleton_plus_overrides","axis":"max_pixel_variables","observation_sha256":"118dea6a4e9f010b85181ef1c0480bdda3444c841414ad9fd91a4244a9e8d2f9","schema_version":"owner-capacity-feasible-world-template-v0.5","side":"L","source_sha256":"118dea6a4e9f010b85181ef1c0480bdda3444c841414ad9fd91a4244a9e8d2f9","training_authorized":false}
