{"ambiguous_overrides":[{"owner_option_id":0,"variable_id":5},{"owner_option_id":0,"variable_id":13},{"owner_option_id":0,"variable_id":14},{"owner_option_id":0,"variable_id":23},{"owner_option_id":0,"variable_id":24},{"owner_option_id":0,"variable_id":33},{"owner_option_id":0,"variable_id":34},{"owner_option_id":0,"variable_id":43},{"owner_option_id":0,"variable_id":44},{"owner_option_id":0,"variable_id":52}],"artifact_binding":{"digest_domain":"canonical_candidate_artifact_bytes","kind":"deferred_exact_sha256","placeholder":"${ARTIFACT_SHA256}","replacement_count":1,"required_format":"lowercase_hex_64"},"assignment_mode":"singleton_plus_overrides","axis":"max_total_rle_runs","observation_sha256":"010a194d13ffdb4dca1aa36186b2eb523a76c1e60e885b503d573f0dcfe6fd2a","schema_version":"owner-capacity-feasible-world-template-v0.5","side":"L","source_sha256":"010a194d13ffdb4dca1aa36186b2eb523a76c1e60e885b503d573f0dcfe6fd2a","training_authorized":false}
